title,artist,artistExistsInDb,description,coverUrl,images,availability,purchaseLink
Autobahn,Jörg Brüggemann,true,"The Autobahn is an asphalt carpet thirteen thousand kilometers in length that covers all of Germany, both interfering with the landscape and interconnecting the country. Jörg Brüggemann photographed it for five years, from 2014 to 2019. While mobility concepts are constantly changing and being discussed, the Autobahn has remained the same in its form—but for how much longer? Brüggemann’s pictures might soon be seen as historical documents. The highway is probably Germany’s most monumental built structure and an integral part of its cultural identity and history. Designed and in its first segments constructed in the 1920s already (before the Nazis), it was given a musical tribute by Kraftwerk in 1974. The Autobahn stands for the unconditional belief in the future of the postwar period, German engineering, driving without speed limits, but also for traffic jams, lineups of trucks, and multivehicle accidents. Brüggemann shares his fascination and doubts through his pictures. They pose questions about the present and future of mobility. How appropriate and sustainable is this gigantic infrastructure today, where unlimited growth and individual freedom on the one hand and ecology and public interest on the other hand meet in visible contradiction every day?
Jörg Brüggemann is a photographer, lecturer, and curator from Berlin. He has been a member of the OSTKREUZ agency since 2009, and has also worked there as managing director and lecturer since 2019. He works for magazines including ZEIT Magazin, GEO, Monocle, and others and has been awarded numerous prizes and scholarships in the past.
Exhibitions
La Chambre, Strsbourg June 25–Sept 4, 2022
Zephyr Raum für Fotografie, Mannheim Sept 5–May 23, 2021
Friche La Belle de Mai, Marseille Summer 2021",https://hartmann-books.com/wp-content/uploads/2020/07/Autobahn_Cover_Shop.jpg,https://hartmann-books.com/wp-content/uploads/2020/07/Autobahn_Durchschau_01_Shop.jpg|https://hartmann-books.com/wp-content/uploads/2020/07/Autobahn_Durchschau_02_Shop.jpg|https://hartmann-books.com/wp-content/uploads/2020/07/Autobahn_Durchschau_03_Shop.jpg|https://hartmann-books.com/wp-content/uploads/2020/07/Autobahn_Durchschau_04_Shop.jpg|https://hartmann-books.com/wp-content/uploads/2020/07/Autobahn_Durchschau_05_Shop.jpg|https://hartmann-books.com/wp-content/uploads/2020/07/Autobahn_Durchschau_06_Shop.jpg|https://hartmann-books.com/wp-content/uploads/2020/07/Autobahn_Durchschau_07_Shop.jpg|https://hartmann-books.com/wp-content/uploads/2020/07/Autobahn_Durchschau_08_Shop.jpg,available,https://hartmann-books.com/en/produkt/jorg-bruggemann-autobahn/
Divided We Stand,Mathias Braschler & Monika Fischer,false,"When Donald Trump was elected to be the forty-fifth president of the United States in 2016, Swiss photographers Monika Fischer and Mathias Braschler were in New York. The results of the election showed a deep divide running through the US and its society—a widening gap dividing the progressive and conservative forces, the urban and the rural, the “red” center of the country and the “blue” coasts. In his first term President Trump did not help to bridge this gap. With his personal style and racist-inflammatory political campaigns, the situation has worsened, especially during the Covid–19 pandemic and the riots of May/June 2020 following the murder of George Floyd. But Trump’s election was only a consequence of this divide. Monika Fischer and Mathias Braschler decided to go on a field-research trip through the US in order to meet the people, from all parts of the country and all parts of society. In April 2019 they started a road trip with a van converted to a practical motorhome including a pop up photo-studio. After leaving New York City they drove 15.000 miles across the nation and visited 40 States. On this self-assigned project they met, interviewed, filmed, and portrayed Americans with a wide variety of backgrounds and very different opinions about life, politics, and their nation. From farmers, factory workers, service people, and investment bankers to politicians and students, all ages, races, professions, and genders are included in this great photographic project capturing a nation that currently finds itself approaching a crucial junction and needs to decide which road to take. DIVIDED WE STAND is the result of this extensive and intensive journey. It combines eighty-two portraits of citizens of the United States and their honest opinions and views about their world. Braschler and Fischer were inspired by famous photographers and their roadtrip-projects, but they created their very own contemporary approach and style for their portraits of the people of the United States.
About the photographers
Mathias Braschler & Monika Fischer live and work in Switzerland and New York. Their collaboration started in 2003 with a first project „About Americans“. They specialize in documenting people from all backgrounds and cultures. Major projects were “China”, “The Human Face of Climate Change”, “Act Now!”, „Faces of Football“. They won numerous awards, including a World Press Photo Award. Their work has appeared in major international magazines, was published in numerous monographs and and has been exhibited in galleries and museums in Europe, Asia, and the United States.
Exhibitions
Stapferhaus, Lenzburg CH, Sept. 9. – Nov. 15, 2020
Lechner Museum, Ingolstadt, Nov. 11. – Sept., 2021
Selected Press
Forbes",https://hartmann-books.com/wp-content/uploads/2020/06/Divided_Cover_Shop.jpg,https://hartmann-books.com/wp-content/uploads/2020/06/Divided_Durchschau_01_Shop.jpg|https://hartmann-books.com/wp-content/uploads/2020/06/Divided_Durchschau_02_Shop.jpg|https://hartmann-books.com/wp-content/uploads/2020/06/Divided_Durchschau_03_Shop.jpg|https://hartmann-books.com/wp-content/uploads/2020/06/Divided_Durchschau_04_Shop.jpg|https://hartmann-books.com/wp-content/uploads/2020/06/Divided_Durchschau_05_Shop.jpg|https://hartmann-books.com/wp-content/uploads/2020/06/Divided_Durchschau_06_Shop.jpg|https://hartmann-books.com/wp-content/uploads/2020/06/Divided_Durchschau_07_Shop.jpg|https://hartmann-books.com/wp-content/uploads/2020/06/Divided_Durchschau_08_Shop.jpg,available,https://hartmann-books.com/en/produkt/mathias-braschler-monika-fischer-divided-we-stand-en/
Übermorgen Schnee,Sonja Trabandt,false,"A story about cancer, depression and friendship
Every year around five hundred thousand people in Germany contract cancer. Almost half of the people who fall ill eventually die of it, and despite all medical progress the diagnosis is still extremely traumatic for anyone. In Tomorrow Snow photographer Sonja Trabandt accompanies her friend A.’s battle with cancer. She approaches the illness in a sensitive and documentary visual narrative style as she follows her friend from the initial diagnosis through all phases of the disease and the associated emotions.
The story can be read on several levels, ranging from the fear of treatment, existential worries, and budding hope to the decisive moment of hair loss and femininity. A.’s coping with everyday life is juxtaposed with feelings such as fear, euphoria, sadness, and the depression following treatments. The photographic perspectives range from analytically staged images to emotional descriptions of the state of mind. Trabandt’s pictures enable the viewer to become familiar with the topic of cancer beyond the moments of shock and fear and to deal with the disease in a meaningful way.
Selected Press
Artconnect
Conscientious | Jörg M. Colberg",https://hartmann-books.com/wp-content/uploads/2020/06/UebermorgenSchnee_Cover_Shop.jpg,https://hartmann-books.com/wp-content/uploads/2020/06/UebermorgenSchnee_Durchschau_01_Shop.jpg|https://hartmann-books.com/wp-content/uploads/2020/06/UebermorgenSchnee_Durchschau_02_Shop.jpg|https://hartmann-books.com/wp-content/uploads/2020/06/UebermorgenSchnee_Durchschau_03_Shop.jpg|https://hartmann-books.com/wp-content/uploads/2020/06/UebermorgenSchnee_Durchschau_04_Shop.jpg|https://hartmann-books.com/wp-content/uploads/2020/06/UebermorgenSchnee_Durchschau_05_Shop.jpg|https://hartmann-books.com/wp-content/uploads/2020/06/UebermorgenSchnee_Durchschau_06_Shop.jpg|https://hartmann-books.com/wp-content/uploads/2020/06/UebermorgenSchnee_Durchschau_07_Shop.jpg|https://hartmann-books.com/wp-content/uploads/2020/06/UebermorgenSchnee_Durchschau_08_Shop.jpg|https://hartmann-books.com/wp-content/uploads/2020/06/UebermorgenSchnee_Durchschau_09_Shop.jpg,available,https://hartmann-books.com/en/produkt/sonja-trabandt-ubermorgen-schnee/
Berlin 1945–2000 A Photographic Subject,Berlin 1945–2000 A Photographic Subject,false,"Berlin, 1945–2000 A Photographic Subject explores how German and international photographers alike photographed Berlin between the immediate postwar years and the end of the twentieth century. Curator and art historian Candice M. Hamelin selected exemplary works by more than twenty photographers. The book, which is published to accompany a major exhibition at the Reinbeckhallen in Berlin—opens with black-and-white photographs of Berlin in ruins and concludes with images of Berlin’s urban development projects after the fall of the Berlin Wall that are often in color and taken with exposure times of up to several years. Images that belong to the genres of street, subjective, architectural, conceptual, portrait, and experimental photography can be found between these two sections. In dialogue with each other, the images in Berlin, 1945–2000: A Photographic Subject underscore the immense social, cultural, and political changes the city underwent and, at the same time, the diverse photographic practices and tendencies that developed in Berlin over the course of fifty-five years.         Photographers in alphabetical order:  Wilfried Bauer, Sibylle Bergemann, Kurt Buchwald, Arno Fischer, Nan Goldin, Herbert Hensky, Max Jacoby, Karl-Ludwig Lange, Will McBride, Rudi Meisel, Roger Melis, Evelyn Richter, Andreas Rost, Michael Schmidt, Gundula Schulze-Eldowy, Maria Sewcz, Michael Wesely, Anno Wilms, Ulrich Wüst, Werner Zellien, Harf Zimmermann, and Miron Zownir
Exhibition
Reinbeckhallen, Berlin, extended until May 30, 2021",https://hartmann-books.com/wp-content/uploads/2020/07/Berlin_Cover_Shop.jpg,https://hartmann-books.com/wp-content/uploads/2020/07/Berlin_Durchschau_01_Shop.jpg|https://hartmann-books.com/wp-content/uploads/2020/07/Berlin_Durchschau_02_Shop.jpg|https://hartmann-books.com/wp-content/uploads/2020/07/Berlin_Durchschau_03_Shop.jpg|https://hartmann-books.com/wp-content/uploads/2020/07/Berlin_Durchschau_04_Shop.jpg|https://hartmann-books.com/wp-content/uploads/2020/07/Berlin_Durchschau_05_Shop.jpg|https://hartmann-books.com/wp-content/uploads/2020/07/Berlin_Durchschau_06_Shop.jpg|https://hartmann-books.com/wp-content/uploads/2020/07/Berlin_Durchschau_08_Shop.jpg,available,https://hartmann-books.com/en/produkt/berlin-1945-2000-a-photographic-subject/
Kontinent,Ostkreuz–Agency of Photographers,false,"“CONTINENT—In Search of Europe” is the new publication and exhibition project of OSTKREUZ—Agency of Photographers, Berlin. On an irregular basis the agency members designate a common topic for them to work on for several years. After To the West, East of Eden, Deutschlandbilder, Ostzeit, The City, On Borders, KONTINENT is the seventh joint thematic publication of the agency members. Over the past three decades they have received recognition in Germany and abroad for their high-quality artistic, documentary photojournalism. In times of shrinking markets for agencies and photographers, OSTKREUZ is truly one of the rare wonders of Berlin. As an artistic and political statement, the twenty-two photographers of the agency focus on the European present with their highly contemporary but diverse photographic series. In this project, the OSTKREUZ photographers explore various aspects of coexistence in Europe, focusing on personal, social, and political phenomena as well as fundamental structures and historical  developments. They always find access to complex content through pictures of people and their environments. The themes of the series range from questions of identity and security, renationalization, migration, and integration to a fundamental understanding of humanism, democracy, and freedom of expression. KONTINENT attempts to offer fruitful impulses for the current debate on Europe by asking questions such as: What connects us? How do we live together? How will our continent develop? How will its people live together? And who exactly does “we” refer to when we are speaking about Europe?
The book is published on the occasion of the exhibition of the same name at the Akademie der Künste, Berlin.
Participating photographers
Jörg Brüggemann, Espen Eichhöfer, Sibylle Fendt, Johanna-Maria Fritz, Annette Hauschild, Harald Hauswald, Heinrich Holtgreve, Tobias Kruse, Ute Mahler, Werner Mahler, Dawin Meckel, Thomas Meyer, Frank Schinski, Jordis Antonia Schlösser, Ina Schoenenburg, Anne Schönharting, Linn Schröder, Stephanie Steinkopf, Mila Teshaieva, Heinrich Völkel, Maurice Weiss, Sebastian Wells und Sibylle Bergemann (1941–2010)
The Podcast of the Exhibition
From 13 July 2020 until the end of September, one of the 22 episodes will be published twice a week – always on Mondays and Thursdays. In conversation with the journalist and author Anja Maier, the photographers reflect on their work in the exhibition. The podcast episodes are available on the following streaming services (only in German):
Spotify, Apple Podcasts, Deezer
Exhibitions
October 2, 2020–April 4, 2021, Academy of Arts, Pariser Platz, Berlin
The comprehensive digital program is also listed there
October 24, 2021–Januar 23, 2022, Kunsthalle Erfurt
February 10–May 28, 2022, Deutsche Börse Photography Foundation, Frankfurt",https://hartmann-books.com/wp-content/uploads/2020/07/Europa_Cover_gross.jpg,https://hartmann-books.com/wp-content/uploads/2020/07/Europa_offen_01.jpg|https://hartmann-books.com/wp-content/uploads/2020/07/Europa_offen_02.jpg|https://hartmann-books.com/wp-content/uploads/2020/07/Europa_offen_03.jpg|https://hartmann-books.com/wp-content/uploads/2020/07/Europa_offen_04.jpg|https://hartmann-books.com/wp-content/uploads/2020/07/Europa_offen_05.jpg|https://hartmann-books.com/wp-content/uploads/2020/07/Europa_offen_06.jpg|https://hartmann-books.com/wp-content/uploads/2020/07/Europa_offen_07.jpg|https://hartmann-books.com/wp-content/uploads/2020/07/Europa_offen_08.jpg|https://hartmann-books.com/wp-content/uploads/2020/07/Europa_offen_09.jpg|https://hartmann-books.com/wp-content/uploads/2020/07/Europa_offen_10.jpg|https://hartmann-books.com/wp-content/uploads/2020/07/Europa_offen_11.jpg|https://hartmann-books.com/wp-content/uploads/2020/07/Europa_offen_12.jpg|https://hartmann-books.com/wp-content/uploads/2020/07/Europa_offen_13.jpg|https://hartmann-books.com/wp-content/uploads/2020/07/Europa_offen_14.jpg|https://hartmann-books.com/wp-content/uploads/2020/07/Europa_offen_15.jpg|https://hartmann-books.com/wp-content/uploads/2020/07/Europa_offen_16.jpg|https://hartmann-books.com/wp-content/uploads/2020/07/Europa_offen_17.jpg|https://hartmann-books.com/wp-content/uploads/2020/07/Europa_offen_18.jpg|https://hartmann-books.com/wp-content/uploads/2020/07/Europa_offen_19.jpg|https://hartmann-books.com/wp-content/uploads/2020/07/Europa_offen_20.jpg|https://hartmann-books.com/wp-content/uploads/2020/07/Europa_offen_21.jpg|https://hartmann-books.com/wp-content/uploads/2020/07/Europa_offen_22.jpg|https://hartmann-books.com/wp-content/uploads/2020/07/Europa_offen_23.jpg|https://hartmann-books.com/wp-content/uploads/2020/07/Europa_offen_24.jpg|https://hartmann-books.com/wp-content/uploads/2020/07/Europa_ruecken.jpg,available,https://hartmann-books.com/en/produkt/ostkreuz-agency-of-photographers-kontinent/
Give my Regards to Elizabeth,Peter Bialobrzeski,true,"This book is a record of Peter Bialobrzeski’s time in England in the early 1990’s, when he finished his studies at the Folkwang School, Essen with a one year DAAD stipend at the London College of Communication. The publication is his diploma work, made in two handbound, then still completely analogue made dummy books. Now, 27 years later the book is published as an almost facsimile version of the original layout.
Coming from a post-unification booming, optimistic Germany economy he found a country and an economy in recession with growing unemployment, declining optimism. Thatcherite capitalism had left it’s deep marks on the faces of people and places. He wanted to capture the class ridden society he was unfamiliar with as a citizen of Germany. The book and his pictures can be seen as a historical document influenced by the british colour photography of the 80’s. In some pictures one can already see the ideas and visual concepts that would make him famous, 20 book publications and numerous exhibitions later Peter Bialobrzeski’s work has been exhibited in Europe, the United States, Asia, Africa and Australia. He is the recipient of numerous awards, including the prestigious World Press Photo Award (2003 and 2010). In2012 he was granted the Dr. Erich Salomon Award by the German Society of Photographers. He is teaching at the HBK in Bremen.
Co-published with Dewi Lewis in the UK and North-America.
Selected Press
The Guardian",https://hartmann-books.com/wp-content/uploads/2020/02/Elizabeth_Cover_Shop-1.jpg,https://hartmann-books.com/wp-content/uploads/2020/02/Elizabeth_Durchschau01_Shop.jpg|https://hartmann-books.com/wp-content/uploads/2020/02/Elizabeth_Doppelseite01_Shop.jpg|https://hartmann-books.com/wp-content/uploads/2020/02/Elizabeth_Doppelseite02_Shop.jpg|https://hartmann-books.com/wp-content/uploads/2020/02/Elizabeth_Doppelseite03_Shop.jpg|https://hartmann-books.com/wp-content/uploads/2020/02/Elizabeth_Doppelseite04_Shop.jpg|https://hartmann-books.com/wp-content/uploads/2020/02/Elizabeth_Doppelseite05_Shop.jpg|https://hartmann-books.com/wp-content/uploads/2020/02/Elizabeth_Doppelseite06_Shop.jpg|https://hartmann-books.com/wp-content/uploads/2020/02/Elizabeth_Doppelseite07_Shop.jpg|https://hartmann-books.com/wp-content/uploads/2020/02/Elizabeth_Back_Shop.jpg,available,https://hartmann-books.com/en/produkt/peter-bialobrzeski-give-my-regards-to-elizabeth-en/
Tree and Soil,Robert Knoth & Antoinette de Jong,false,"Eight years after their now-legendary publication Poppy—Trails of Afghan Heroin, Robert Knoth and Antoinette de Jong have completed their next long-term project, Tree and Soil. Following the 2011 nuclear disaster they photographed and filmed the changing landscapes in the closed zones around Fukushima over a period of five years. They documented evacuated farmhouses, gardens, agricultural fields, and the surrounding hills and forests and interviewed former inhabitants of the area. In this book they combine their own landscape photography with historical material from the collection of naturalist and explorer Philipp Franz von Siebold. In the early nineteenth century Siebold had the opportunity to travel throughout Japan and to take home not only vast quantities of artefacts as well as plant and animal specimens, but also a treasure trove of woodblock prints made by artists such as Kawahara Keiga. Siebold’s collections—now in the possession of Naturalis Biodiversity Center in Leiden, the Netherlands—illustrate how Japanese culture is deeply rooted in and inspired by nature. Siebold perfectly represents the mindset that became typical for the Age of Exploration -and onwards- in which explorers started to travel the globe to uncover the secrets of the natural world and all its treasures for the benefit of humankind. This era can be seen as a prequel to the Anthropocene, in which our planet has been profoundly changed by human activity. In Tree and Soil Knoth and de Jong underline the intrinsic beauty and value of nature, connecting the past and present by documenting and interpreting the transformations of the deserted landscapes around Fukushima.
„At times we felt like archaeologists of the future, trying to understand what happened in a distant past when a mysterious force resulted in the evacuation of towns, villages, and forests, leaving only a residue of human presence.“
This book has been long in the making. It was carefully edited by the authors with curator Iris Sikking, designed by Kummer&Herrman, renowned Dutch designers of many award-winning photobooks, and beautifully produced by printer Rob Stolk in a very limited one-time edition.
About the photographers
Robert Knoth (*1963, Rotterdam) and Antoinette de Jong (*1964, Tilburg) are based in the Netherlands. They have received numerous awards, and their work has been featured in many solo and group exhibitions in leading festivals and museums. Website
Quote Robert Knoth and Antoinette de Jong
„Digital technologies have caused a seismic change to our position as documentary makers, giving us endless possibilities in narrative formats. We started experimenting with more layered forms of storytelling fusing the hyperrealism of documentary with the more abstract and conceptual qualities within the visual arts.“
Exhibitions
Museum Kulturspeicher, Würzburg, March 27– May 24 2021
Museum Hundertwasser/Kunsthaus Wien, Vienna, Oct. 10.–Feb. 20, 2022
Biennale Mannheim, March 19–May 22, 2022
Fotomuseum, Den Haag, Spring 2022
Selected Press
lensculture-best photo books 2020
1000 words mag-best photobooks 2020
de Volkskrant (NL)
De Leesclub van Alles (NL)
Photo Q | World Press Photo
Photomonitor",https://hartmann-books.com/wp-content/uploads/2020/04/TreeandSoil_Cover_Shop.jpg,https://hartmann-books.com/wp-content/uploads/2020/04/TreeandSoil_Durchschau01_Shop.jpg|https://hartmann-books.com/wp-content/uploads/2020/04/TreeandSoil_Durchschau02_Shop.jpg|https://hartmann-books.com/wp-content/uploads/2020/04/TreeandSoil_Durchschau03_Shop.jpg|https://hartmann-books.com/wp-content/uploads/2020/04/TreeandSoil_Durchschau04_Shop.jpg|https://hartmann-books.com/wp-content/uploads/2020/04/TreeandSoil_Durchschau05_Shop.jpg|https://hartmann-books.com/wp-content/uploads/2020/04/TreeandSoil_Durchschau06_Shop.jpg|https://hartmann-books.com/wp-content/uploads/2020/04/TreeandSoil_Durchschau07_Shop.jpg|https://hartmann-books.com/wp-content/uploads/2020/04/TreeandSoil_Durchschau11_Shop-1.jpg|https://hartmann-books.com/wp-content/uploads/2020/04/TreeandSoil_Durchschau12_Shop.jpg|https://hartmann-books.com/wp-content/uploads/2020/04/TreeandSoil_Durchschau13_Shop.jpg|https://hartmann-books.com/wp-content/uploads/2020/04/TreeandSoil_Durchschau08_Shop.jpg|https://hartmann-books.com/wp-content/uploads/2020/04/TreeandSoil_Durchschau14_Shop.jpg|https://hartmann-books.com/wp-content/uploads/2020/04/TreeandSoil_Durchschau15_Shop.jpg|https://hartmann-books.com/wp-content/uploads/2020/04/TreeandSoil_Durchschau11_Shop.jpg,available,https://hartmann-books.com/en/produkt/robert-knoth-antoinette-de-jong-tree-and-soil-en/
Hypothesis,Henrik Spohler,false,"The photographic project Hypothesis by Henrik Spohler addresses the world of science and research in analytical, documentary images and poses questions about our relationship to nature and the environment. His photographs show experiments and scientific facilities on the edge of what is technically feasible. The photo essay with approx. 50 images are divided into four sections: The chapter “Time” deals with geological time, time measurement and the existence of the universe. The chapter “Space” shows, among other things, satellites or observatories that look into the depths of space. “Matter” provides insights into research on the smallest parts of nature and “Life” deals with basic research on animal and plant organisms and humans. The four topics complement each other and create a photo series with its very own cosmos—a pictorial mega-laboratory that is partly detached from the outside world and obeys a single goal without any concrete specification: to provide the world of tomorrow with new insights. In a world where it has become politically possible to ignore or even negate scientific findings, the Hypothesis project uses documentary photography to show a complex and highly developed scientific system as the basis for an enlightened and future-minded society.
About the artist at Hartmann Projects
Selected reviews
GUP
Freundeskreis des Hauses der Photografie – Video-interview (in German) between Henrik Spohler and Ulrich Rüther
kasseler fotobuchblog",https://hartmann-books.com/wp-content/uploads/2019/11/Hypothesis_Cover_Shop.jpg,https://hartmann-books.com/wp-content/uploads/2019/11/Hypothesis_Front_Spohler.jpg|https://hartmann-books.com/wp-content/uploads/2019/11/Hypothesis_Doppelseite01_Spohler.jpg|https://hartmann-books.com/wp-content/uploads/2019/11/Hypothesis_Doppelseite02_Spohler.jpg|https://hartmann-books.com/wp-content/uploads/2019/11/Hypothesis_Doppelseite03_Spohler.jpg|https://hartmann-books.com/wp-content/uploads/2019/11/Hypothesis_Doppelseite04_Spohler.jpg|https://hartmann-books.com/wp-content/uploads/2019/11/Hypothesis_Doppelseite05_Spohler.jpg|https://hartmann-books.com/wp-content/uploads/2019/11/Hypothesis_Doppelseite06_Spohler.jpg|https://hartmann-books.com/wp-content/uploads/2019/11/Hypothesis_Back_Spohler.jpg,available,https://hartmann-books.com/en/produkt/henrik-spohler-hypothesis-en/
