title,artist,artistExistsInDb,description,coverUrl,images,availability,purchaseLink
Derby,Ken Graves and Eva Lipman,false,"Hardcover with dust jacket60 pages, 28 duotone plates9.25 x 10.5 inches / 235 x 267 mm2021ISBN 978-1-942953-47-0
Demolition derbies are spectacular celebrations of car culture, carnival culture, and a maximalist desire to be loud and destructive, all because… well, why not?  They’re chaotic, a ritualized nihilism of automotive destruction, metal and mud everywhere, but in Ken Graves and Eva Lipman’s Derby, an understated poetry emerges from the scene. There is not a collision to be found; instead the couple focuses on the nuanced moments that surround the event, crafting images that are equally anthropological and expressive, yet surprisingly quiet and kind, revealing the inexplicable beauty of a community in complete control of its own entertainment.
As viewers, we become privy to an endless cycle of wreckage and repair. Before an event, amateur mechanics make ad hoc repairs with full knowledge that their hard work will be undone in half the time. Sisyphean to a T. Chicken wire replaces windshields and gangly teenagers gut the interior of someone’s former dream car, which they likely bought the day before for the price of an old lawn mower. The cars are merely something to use and abuse, and possibly provide some laughs along the way. Hell, you might even break a rib or two.
For more than three decades Ken Graves and Eva Lipman were partners in both life and art. Always shooting as a singular entity, they blurred the lines of authorship and shared equal artistic credit for their images.
 
Press:
The Washington PostHyperallergicCollector Daily",https://cdn.shopify.com/s/files/1/1031/7969/files/Derby-04.jpg?v=1628646969,https://cdn.shopify.com/s/files/1/1031/7969/files/Derby-06.jpg?v=1628646988|https://cdn.shopify.com/s/files/1/1031/7969/files/Derby-13.jpg?v=1628647026|https://cdn.shopify.com/s/files/1/1031/7969/files/Derby-15.jpg?v=1628647046|https://cdn.shopify.com/s/files/1/1031/7969/files/Derby-22.jpg?v=1628647125|https://cdn.shopify.com/s/files/1/1031/7969/files/Derby-18.jpg?v=1628647146|https://cdn.shopify.com/s/files/1/1031/7969/files/Derby-27.jpg?v=1628647169,sold-out,https://tbwbooks.com/products/derby
Midnight la Frontera,Ken Light,false,"Hardcover with tip-on front and verso136 pages, 66 plates 11.25 x 13.25 in. / 286 x 337 mmIntroductory text by José Ángel Navejas in English and Spanish2020ISBN 978-1-942953-43-2
Special edition available here
 
The stretch between Tijuana and San Diego is long. Very long. And it is as treacherous as it is beautiful. It is unlikely that anybody who has ever crossed it will easily forget it. Its desert like landscape is bound to carve itself equally onto body and soul.
—José Ángel Navejas 
Between 1983 and 1987 along the California / Mexico border, Ken Light took his Hasselblad camera and flash and rode along with US Border Patrol agents in the middle of the night as they combed the Otay Mesa looking for “illegal aliens.” He was there when they were apprehended – captured by authorities as well as the photographer’s flash. The black and white images are stark, impromptu mug shots in the desert, taken at a moment of extreme vulnerability, when hope gave way to despair, migrants caught in a cruel game of hide and seek.
Light’s photographs and José Ángel Navejas’ first hand, compelling memoir, presented in both English and Spanish, offer testimony of the harrowing night border crossing of those desperately seeking a chance at a better life. A day after Navejas first crossed the US border from Mexico, he was caught and deported back onto the streets of Tijuana. Undeterred, he crawled back through a tunnel to San Diego, where he entered the United States forever.
In piercing words and in the dark of night, Midnight la Frontera’s immediacy underscores the struggle and defiance of those who make the perilous hike for days and weeks in search of the American Dream.
 
Press:
The Financial TimesThe New York TimesHarper's MagazineGup MagazineL'Oeil de la PhotographieCollector DailyNearest TruthHuck Magazine",https://cdn.shopify.com/s/files/1/1031/7969/files/Midnight_La_Frontera-4_contrast_2048x2048.jpg?v=1585693460,https://cdn.shopify.com/s/files/1/1031/7969/files/Midnight_La_Frontera-6_contrast_2048x2048.jpg?v=1585693554|https://cdn.shopify.com/s/files/1/1031/7969/files/Midnight_La_Frontera-7_contrast_2048x2048.jpg?v=1585693663|https://cdn.shopify.com/s/files/1/1031/7969/files/Midnight_La_Frontera-9_contrast_2048x2048.jpg?v=1585693699|https://cdn.shopify.com/s/files/1/1031/7969/files/Midnight_La_Frontera-12_contrast_2048x2048.jpg?v=1585693848|https://cdn.shopify.com/s/files/1/1031/7969/files/Midnight_La_Frontera-13_contrast_2048x2048.jpg?v=1585693878|https://cdn.shopify.com/s/files/1/1031/7969/files/Midnight_La_Frontera-18_contrast_2048x2048.jpg?v=1585693909,sold-out,https://tbwbooks.com/products/midnight-la-frontera
The Imperfect Atlas,Peter Funch,false,"Softcover with four color-printed PVC dust jacket144 pages, 70 plates plus index of sourced reference materials8.75 x 12.25 in. / 222 x 311 mmAfterword featuring William Pym in conversation with Peter Funch2019ISBN 978-1-942953-42-570
Peter Funch’s latest project addresses the passage of time and man’s continued and evolving effects on the environment. Appropriately, Funch explores the Anthropocene by employing a photographic technique invented at the height of the Industrial Revolution, that of RGB tri-color separations. 
Featuring images captured during Funch’s various trips through the Northern Cascade Mountain Range, the book is an imperfect recreation of landscapes and wilderness as depicted in the archive of vintage postcards and ephemera of the region the artist amassed throughout his travels.
Using maps and satellite imagery to locate the position where the postcard images were created, Funch recaptures the landscapes across three distinct exposures via red, green, and blue filters, transposed one on top of the other. 
As time collapses across the recreated landscapes, features and events are revealed or obscured by each successive filter, speaking to what Funch calls “our blindness to the consequences we are creating.” The Imperfect Atlas brings to light a dialogue on man’s severe and accelerated impact on nature, a solemn and mystifying visual archive of a wilderness the future may not behold.",https://cdn.shopify.com/s/files/1/1031/7969/files/TBW-Books-The-Imperfect-Atlas-Peter-Spreads-02_0158e3c2-0012-42f4-9160-8944e5e9e2c3_1024x1024.jpg?v=1572467630,https://cdn.shopify.com/s/files/1/1031/7969/files/TBW-Books-The-Imperfect-Atlas-Peter-Spreads-03_8b8f8d00-69ac-45f0-b696-23e24c654369_1024x1024.jpg?v=1572467636|https://cdn.shopify.com/s/files/1/1031/7969/files/TBW-Books-The-Imperfect-Atlas-Peter-Spreads-04_3f51e75b-6c27-4756-bf72-219eacc4eb81_1024x1024.jpg?v=1572467642|https://cdn.shopify.com/s/files/1/1031/7969/files/TBW-Books-The-Imperfect-Atlas-Peter-Spreads-05_3d150f7d-04f4-4a74-b8dc-ca6eb62ab9ca_1024x1024.jpg?v=1572467647|https://cdn.shopify.com/s/files/1/1031/7969/files/TBW-Books-The-Imperfect-Atlas-Peter-Spreads-06_68115a70-4cb5-434a-a9a2-3ca8e392b04d_1024x1024.jpg?v=1572467651|https://cdn.shopify.com/s/files/1/1031/7969/files/TBW-Books-The-Imperfect-Atlas-Peter-Spreads-07_71388f05-f9eb-463c-a665-3dc1e1978377_1024x1024.jpg?v=1572467656|https://cdn.shopify.com/s/files/1/1031/7969/files/TBW-Books-The-Imperfect-Atlas-Peter-Spreads-08_09226fe9-7ec8-4148-be27-f2f25e85efd4_1024x1024.jpg?v=1572467660,sold-out,https://tbwbooks.com/products/the-imperfect-atlas
Family Car Trouble (First Edition),Gus Powell,false,"Hardcover with dust jacket128 pages, 74 plates6 x 8.75 in. / 152 x 222 mmISBN 978-1-942953-39-5Edition of 940
 
Family. Car. Trouble. Three nouns. When doesn't trouble follow both family and car? A tender series of pictures: I fell in love with everybody. Especially the car.
— Sally Mann
 
With Family Car Trouble, Gus Powell plays with the form of the novel, both as material object and as narrative vehicle for expressing interior life. The work records and reckons with the arrival of children, the departure of a father, and the maintenance of a difficult 1992 Volvo 940 station wagon. 
A new classic of the Automotive Bereavement Parenting genre.
Gus Powell was born in New York City in 1974. His previous books include The Lonely Ones (J&L Books, 2015) and The Company of Strangers (J&L Books, 2003).
 
Reviews:
 
Powell tells a tale of life as it happens, poetically interwoven, stylistically cohesive. His pictures are close to the bone; there are no photographs of him, but he is, nevertheless, present throughout. 
— Elisabeth Biondi
 
I yearn for my driving days. 
— Maria Friedlander
 
Gus Powell photographs through and across the deep range of emotions that exist within the microcosm of family.  He does this in a subtle and honest way, reminding us of the big and small, the joyful and the painful, and the dark and light moments in life and in death.  The work transmits deep feeling for the challenges and magic of being between young children and older parents. 
— Elinor Carucci
 
2019 was a banner year for photo books. Dozens of publications impressed me with their creative horsepower. But the one that touched me the most, Gus Powell’s Family Car Trouble, is as modest, sturdy and lovable as the 1993 Volvo it features. 
— Alec Soth, photo-eye
 
Gus Powell’s masterful family photo novella. Beautiful, sad and bittersweet. Perfect. The Volvo cried, and I cried with it. 
— Christian Patterson, photo-eye
 
Gus Powell’s book is a delicate balance of extremes – motion and stillness, life and death, skin and steel – a young family, a dying father and the constant maintenance of a 1992 Volvo. The car provides the necessary comic metaphor from what otherwise would have been an oppressive narrative. Many photographers have tried to share their parental loss but few have succeeded. Family Car Trouble is regarded as “a new classic of the Automotive Bereavement Parenting genre. 
— Jeff Ladd, PhotoBookStore Magazine
 
Gus Powell’s new book Family Car Trouble is one of the most touching and thoughtful works I have seen in some time. It is a tribute to Powell’s mental fortitude that he was able to conceive of such a moving project at a time of such despair. While we grapple with the death of his father, Powell reminds us of the wonderment of life by turning his lens towards his two curious and energetic kids. The interweaving stories of life, death, and Gus’s unceasing car troubles reminds us all that in the face of tragedy—whether you are ready for it or not—life moves on or, in this case, hovers in the mechanic’s parking lot. Powell’s deeply personal story is accentuated by the scale, design, and sequence of the book; as usual, everything is keenly considered in a Gus Powell production. 
— Christopher McCall, Director, Pier 24 Photography, LensCulture
 
 Softcover Edition Available HERE",https://cdn.shopify.com/s/files/1/1031/7969/files/FamilyCarTrouble_08_2048_2048x2048.jpg?v=1576789853,https://cdn.shopify.com/s/files/1/1031/7969/files/FamilyCarTrouble_28_2048_2048x2048.jpg?v=1576789856|https://cdn.shopify.com/s/files/1/1031/7969/files/FamilyCarTrouble_38_2048_2048x2048.jpg?v=1576789846|https://cdn.shopify.com/s/files/1/1031/7969/files/FamilyCarTrouble_29_2048_2048x2048.jpg?v=1576789855|https://cdn.shopify.com/s/files/1/1031/7969/files/FamilyCarTrouble_22_2048_2048x2048.jpg?v=1576789853|https://cdn.shopify.com/s/files/1/1031/7969/files/FamilyCarTrouble_49_2048_2048x2048.jpg?v=1576789847|https://cdn.shopify.com/s/files/1/1031/7969/files/FamilyCarTrouble_59_2048_2048x2048.jpg?v=1576789854,sold-out,https://tbwbooks.com/products/family-car-trouble
Family Car Trouble (Second Edition),Gus Powell,false,"Softcover with flaps128 pages, 74 plates6 x 8.75 in. / 152 x 222 mm2019ISBN 978-1-942953-49-4
Family. Car. Trouble. Three nouns. When doesn't trouble follow both family and car? A tender series of pictures: I fell in love with everybody. Especially the car.
— Sally Mann
With Family Car Trouble, Gus Powell plays with the form of the novel, both as material object and as narrative vehicle for expressing interior life. The work records and reckons with the arrival of children, the departure of a father, and the maintenance of a difficult 1992 Volvo 940 station wagon. 
A new classic of the Automotive Bereavement Parenting genre.
Gus Powell was born in New York City in 1974. His previous books include The Lonely Ones (J&L Books, 2015) and The Company of Strangers (J&L Books, 2003).
 
Reviews:
Powell tells a tale of life as it happens, poetically interwoven, stylistically cohesive. His pictures are close to the bone; there are no photographs of him, but he is, nevertheless, present throughout. 
— Elisabeth Biondi
I yearn for my driving days. 
— Maria Friedlander
Gus Powell photographs through and across the deep range of emotions that exist within the microcosm of family.  He does this in a subtle and honest way, reminding us of the big and small, the joyful and the painful, and the dark and light moments in life and in death.  The work transmits deep feeling for the challenges and magic of being between young children and older parents. 
— Elinor Carucci
2019 was a banner year for photo books. Dozens of publications impressed me with their creative horsepower. But the one that touched me the most, Gus Powell’s Family Car Trouble, is as modest, sturdy and lovable as the 1993 Volvo it features. 
— Alec Soth, photo-eye
Gus Powell’s masterful family photo novella. Beautiful, sad and bittersweet. Perfect. The Volvo cried, and I cried with it. 
— Christian Patterson, photo-eye
Gus Powell’s book is a delicate balance of extremes – motion and stillness, life and death, skin and steel – a young family, a dying father and the constant maintenance of a 1992 Volvo. The car provides the necessary comic metaphor from what otherwise would have been an oppressive narrative. Many photographers have tried to share their parental loss but few have succeeded. Family Car Trouble is regarded as “a new classic of the Automotive Bereavement Parenting genre. 
— Jeff Ladd, PhotoBookStore Magazine
Gus Powell’s new book Family Car Trouble is one of the most touching and thoughtful works I have seen in some time. It is a tribute to Powell’s mental fortitude that he was able to conceive of such a moving project at a time of such despair. While we grapple with the death of his father, Powell reminds us of the wonderment of life by turning his lens towards his two curious and energetic kids. The interweaving stories of life, death, and Gus’s unceasing car troubles reminds us all that in the face of tragedy—whether you are ready for it or not—life moves on or, in this case, hovers in the mechanic’s parking lot. Powell’s deeply personal story is accentuated by the scale, design, and sequence of the book; as usual, everything is keenly considered in a Gus Powell production. 
— Christopher McCall, Director, Pier 24 Photography, LensCulture",https://cdn.shopify.com/s/files/1/1031/7969/files/FCT_Layout_14_Final_Correct_outlined_text_07_31_2019_dragged.jpg?v=1633466427,https://cdn.shopify.com/s/files/1/1031/7969/files/FCT_Layout_14_Final_Correct_outlined_text_07_31_2019_dragged_2.jpg?v=1633466083|https://cdn.shopify.com/s/files/1/1031/7969/files/FCT_Layout_14_Final_Correct_outlined_text_07_31_2019_dragged_4.jpg?v=1633466383|https://cdn.shopify.com/s/files/1/1031/7969/files/FCT_Layout_14_Final_Correct_outlined_text_07_31_2019_dragged_5.jpg?v=1633466388|https://cdn.shopify.com/s/files/1/1031/7969/files/FCT_Layout_14_Final_Correct_outlined_text_07_31_2019_dragged_7.jpg?v=1633466407|https://cdn.shopify.com/s/files/1/1031/7969/files/FCT_Layout_14_Final_Correct_outlined_text_07_31_2019_dragged_8.jpg?v=1633466899|https://cdn.shopify.com/s/files/1/1031/7969/files/FCT_Layout_14_Final_Correct_outlined_text_07_31_2019_dragged_9.jpg?v=1633466417,sold-out,https://tbwbooks.com/products/family-car-trouble-second-printing-softcover-edition
Driftless,Jason Vaughn and Brad Zellar,false,"Clothbound hardcover with tip-on verso92 pages, 50 color plates9 x 11.25 in. / 230 x 286 mm2018ISBN 978-1-942953-38-8
Special edition available here
 
The images in Driftless were made by photographer Jason Vaughn during a period of life that found him wandering for a year in a region of Wisconsin known colloquially as the Driftless Area, named for the rugged terrain formed by a lack of pre-Illinoian continental glacial ice flow (“drift”). Vaughn’s temporary home seemingly describes the landscape as much as its human inhabitants.
While living in a rented apartment off the Mississippi River, awaiting the birth of his second child, and at the beginning of a second life chapter following a tenuous bout with cancer, Vaughn attempted to establish community despite his status as temporary visitor. During this in-between state his daily walks not only nurtured his art practice but also allowed for moments of clarity and belonging to seep into that practice.
Continuing in this spirit of a shared yet transient experience, the final image edit was given to author and journalist Brad Zellar, to lend his own verbal meanderings to the images, embedding a dueling but complementary narrative to the book.
An otherwise charged photograph of birds mid-flight, no doubt bound for a warmer and more hospitable climate is subdued and balanced by the caption “hey, options.”
Amongst his words, casual, yet world weary, we find a sense of sophisticated levity, fostering feelings of the hope over despair.
While creating the images for Driftless, Vaughn intimates that living next to the river allowed him to contemplate the human experience in a new way and to meditate on “the process by which people can drift through a space, sometimes becoming lodged, sometimes becoming permanent, and sometimes breaking free and moving to a new location.”
As a duo, Vaughn and Zellar assist one another in weaving a narrative until their voices seem one.  Each fleeting moment adds a layer of meaning, transforming, over time, from a conversation to a shared story.",https://cdn.shopify.com/s/files/1/1031/7969/files/Driftless_Spread_mock_01_2048_2048x2048.jpg?v=1537309848,https://cdn.shopify.com/s/files/1/1031/7969/files/Driftless_Spread_mock_11_2048_2048x2048.jpg?v=1537309658|https://cdn.shopify.com/s/files/1/1031/7969/files/Driftless_Spread_mock_08_2048_2048x2048.jpg?v=1537309675|https://cdn.shopify.com/s/files/1/1031/7969/files/Driftless_Spread_mock_07_2048_2048x2048.jpg?v=1537309682|https://cdn.shopify.com/s/files/1/1031/7969/files/Driftless_Spread_mock_02_2048_2048x2048.jpg?v=1537309715|https://cdn.shopify.com/s/files/1/1031/7969/files/Driftless_Spread_mock_06_2048_2048x2048.jpg?v=1537309687|https://cdn.shopify.com/s/files/1/1031/7969/files/Driftless_Spread_mock_05_2048_2048x2048.jpg?v=1537309696,sold-out,https://tbwbooks.com/products/driftless
A-B-Cheeeese!,Children's Book,false,"Hardcover56 pages, 26 four-color plates8 x 9 in. / 203 x 229 mmEdited by Paul and Sarah SchiekDesigned by Jason Munn2016ISBN 978-1-942953-23-4
 
A unique and wholly new way to approach the alphabet, A-B-Cheeeese! is a found-photo collection of children doing what children do best, smiling and laughing for the camera. Edited by husband and wife, Paul and Sarah Schiek, the photos challenge the usual ""A is for Apple"" fare in this nostalgic children's book. Here, C is for Curious, H is for Hello and P is for Piñata!
 
Curated to provoke conversation, A-B-Cheeeese! is as entertaining for kids as it is for parents reading alongside and explaining that the blue thing with a chord in ""H is for Hello"" is what a telephone used to look like. The book takes us on a journey to explore a bygone time when the people and objects in a photo held as much of an intriguing importance as the physical photographs themselves.
 
Designer Jason Munn, renowned for his iconic rock posters, takes over design duties for the project, with his clever and clean type style lending itself perfectly to the genre of children's books.",https://cdn.shopify.com/s/files/1/1031/7969/files/ABC_image_05_large.jpg?3481940262377338633,https://cdn.shopify.com/s/files/1/1031/7969/files/ABC_image_06_large.jpg?3481940262377338633|https://cdn.shopify.com/s/files/1/1031/7969/files/ABC_image_07_large.jpg?3481940262377338633|https://cdn.shopify.com/s/files/1/1031/7969/files/ABC_image_08_large.jpg?3481940262377338633|https://cdn.shopify.com/s/files/1/1031/7969/files/ABC_image_03_large.jpg?3481940262377338633|https://cdn.shopify.com/s/files/1/1031/7969/files/ABC_image_04_large.jpg?3481940262377338633|https://cdn.shopify.com/s/files/1/1031/7969/files/ABC_image_01_large.jpg?3481940262377338633,sold-out,https://tbwbooks.com/products/abcheeeese
Order of Appearance,Jim Jocoy,false,"Foil-embossed clothbound hardcover with tip-on84 pages, 44 full color plates9 x 12.25 in. / 229 x 310 mm2017ISBN 978-1-942953-30-2
 
Special edition available here
 
 
 
The eye of Jim Jocoy finds beauty in the wild. His photography is always in service to the magic of the devious iconoclast, exhibiting dignity to the outriders.
 
— Thurston Moore
 
 
Almost twenty years after the release of his first monograph, We’re Desperate, produced with the help of Sonic Youth's Thurston Moore and fashion designer Marc Jacobs and widely regarded as the definitive catalog of early West Coast punk fashion, Jim Jocoy’s archive of previously unseen photographs has been re-examined and re-considered to compose Order of Appearance, a new body of work that humanizes his young subjects as they go through their daily lives sharing the tender moments of love and loss that came to encapsulate the late 70s and early 80s as the Summer of Love slowly eroded and gave way to punks’ disaffected view of the world.",https://cdn.shopify.com/s/files/1/1031/7969/files/TBW_Books_Order_of_Appearance_Spreads_08_1024px_1024x1024.jpg?v=1527102474,https://cdn.shopify.com/s/files/1/1031/7969/files/TBW_Books_Order_of_Appearance_Spreads_01_1024px_1024x1024.jpg?v=1527102479|https://cdn.shopify.com/s/files/1/1031/7969/files/TBW_Books_Order_of_Appearance_Spreads_03_1024px_1024x1024.jpg?v=1527102478|https://cdn.shopify.com/s/files/1/1031/7969/files/TBW_Books_Order_of_Appearance_Spreads_07_1024px_1024x1024.jpg?v=1527102473|https://cdn.shopify.com/s/files/1/1031/7969/files/TBW_Books_Order_of_Appearance_Spreads_22_1024px_1024x1024.jpg?v=1527102469|https://cdn.shopify.com/s/files/1/1031/7969/files/TBW_Books_Order_of_Appearance_Spreads_18_1024px_1024x1024.jpg?v=1527102470|https://cdn.shopify.com/s/files/1/1031/7969/files/TBW_Books_Order_of_Appearance_Spreads_20_1024px_1024x1024.jpg?v=1527102473,sold-out,https://tbwbooks.com/products/order-of-appearance
