title,artist,artistExistsInDb,description,coverUrl,images,availability,purchaseLink
Tender,Carla Williams,false,"Second Edition
Softcover with French fold jacket166 pages, 80 plates8 x 10 in / 203 x 254 mm2024ISBN 978-1-942953-72-2
First Edition
Softcover with dust jacket160 pages, 80 plates8 x 10 in. / 203 x 254 mmSigned and numbered by the artistIncludes an original 4 x 6 inch / 102 x 152 mm print2023ISBN 978-1-942953-59-3
TBW Books is pleased to present Tender, the first monograph by artist Carla Williams. Made in private between 1984 and 1999 and kept mostly to herself for more than thirty years, the images in Tender comprise a complete, personal self-portrait of a young, queer, Black woman intimately exploring the realm of her own possibility. When Williams was eighteen and studying photography at Princeton, she began making the black and white and color portraits in Tender to create pictures in her own image. Her mind was filled equally with the canonical images of the medium’s male-driven history and the posing women discovered during her youth in her father’s pornography collection. Using her own body, Williams created the portraits she had never seen before. Made with instant Polaroid 35mm and 4x5 type 55 film formats, Williams profited from the near instant result to continuously play with her own expression and form. An act of tender commune with herself, these are every version of the artist on full display: provocative, playful, sensual, gentle, powerful, mean, glamorous, forlorn, funny. The photographs in Tender are ignited with the raw energy of a young artist on the cusp of adulthood and her own burgeoning sexual identity. Included in the book are essays by the artist and scholar Dr. Mireille Miller-Young.Winner of the 2023 Paris Photo – Aperture Foundation First PhotoBook Award",https://cdn.shopify.com/s/files/1/1031/7969/files/TBW_6-20-219957_d06a067c-24cd-4aca-b428-c8287126ff02.webp?v=1728411337,https://cdn.shopify.com/s/files/1/1031/7969/files/TBW_6-20-219995.webp?v=1728411341|https://cdn.shopify.com/s/files/1/1031/7969/files/TBW_6-20-2110016.webp?v=1728411342|https://cdn.shopify.com/s/files/1/1031/7969/files/TBW_6-20-219965_ea609a0e-ddbd-4083-a085-5942becba339.webp?v=1728411341|https://cdn.shopify.com/s/files/1/1031/7969/files/TBW_6-20-2110010.webp?v=1728411341|https://cdn.shopify.com/s/files/1/1031/7969/files/TBW_6-20-2110001.webp?v=1728411342,sold-out,https://tbwbooks.com/products/tender-second-edition
42nd and Vanderbilt (Second Edition),Peter Funch,false,"Softcover with tip-ons180 pages,131 color plates7.7 x 9.8 in / 195 x 250 mmAfterword by Douglas Coupland
2024ISBN 978-1-942953-73-9

Between 8:30 am and 9:30 am, from 2007 to 2016, at the southern corner of 42nd Street and Vanderbilt Avenue in New York City

Danish photographer, Peter Funch, placed these rigid confines upon his nine year photographic project, 42nd and Vanderbilt. Narrowing the infinite opportunities N.Y.C. has to offer an artist, Funch brings to the surface the minutiae contained within a fragment of our daily routine, the short walk from point A to point B, reminding us that the practice of photography in general, and street photography specifically, has only scratched the surface of possibility. Through categorical editing, equal parts intuitive and scientific, human patterning and mannerisms normally passed over on first read, become meditations on time, mortality, public and private space, the economy, and our inner selves. Funch employs a method that novelist and visual artist Douglas Coupland aptly describes in the book's afterword as ""a kinder, gentler kind of surveillance.""

In one example, what appears to be a diptych of a woman with images taken only seconds apart, slowly becomes a “Spot the Difference” puzzle: subtle variations in attire, hair, light and shadow emerge as we the viewer realize, in both wonder and consternation, that the images were in fact taken days, months, or perhaps even years apart.

This simple and effective mechanism employed by Funch permeates the ordinary with the extraordinary. The fact that our own unknown tendencies, together with the rhythms and denizens of our surrounding ecosystem, can endure and replay over a path traveled thousands of times, becoming akin to performance, is nothing short of a revelation.

This new softcover edition features four new subjects in addition to the originally published images.",https://cdn.shopify.com/s/files/1/1031/7969/files/1_931af9dd-9c9a-4b26-bd18-3d274a3955b9.jpg?v=1730317081,https://cdn.shopify.com/s/files/1/1031/7969/files/2_45a60ad2-c99e-4f54-b5df-cc49134d937d.jpg?v=1730317081|https://cdn.shopify.com/s/files/1/1031/7969/files/3_1020fbda-9a14-4cab-ad51-fe380855443a.jpg?v=1730317081|https://cdn.shopify.com/s/files/1/1031/7969/files/4_3b303f66-58a6-42ca-9622-796c4f451948.jpg?v=1730317081|https://cdn.shopify.com/s/files/1/1031/7969/files/5_eb7479c7-863e-4b4c-bebb-54852788c969.jpg?v=1730317081|https://cdn.shopify.com/s/files/1/1031/7969/files/6_fda3c8f9-05b2-4540-9c27-174afa273d43.jpg?v=1730317081|https://cdn.shopify.com/s/files/1/1031/7969/files/7_659af6f6-3214-4ea5-85d2-bda9527c4d39.jpg?v=1730317081,sold-out,https://tbwbooks.com/products/42nd-and-vanderbilt-second-edition
Juggling Is Easy (Second Edition),Peggy Nolan,false,"Softcover with dust jacket96 pages, 69 duotone plates8.5 x 11.25 in. / 216 x 286 mmEssay by Rebecca Bengal2023ISBN 978-1-942953-62-3
What it looks like when a mother in South Florida raises seven kids on her own while photographing their every move.
 
Press:
VogueNew York MagazineThe GuardianJuxtapozLenscratchTrue Photo Journal",https://cdn.shopify.com/s/files/1/1031/7969/files/PN_JIE-61.jpg?v=1674679845,https://cdn.shopify.com/s/files/1/1031/7969/files/PN_JIE-5.jpg?v=1674679877|https://cdn.shopify.com/s/files/1/1031/7969/files/PN_JIE-64.jpg?v=1674680088|https://cdn.shopify.com/s/files/1/1031/7969/files/PN_JIE-9.jpg?v=1674679890|https://cdn.shopify.com/s/files/1/1031/7969/files/PN_JIE-11.jpg?v=1674679900|https://cdn.shopify.com/s/files/1/1031/7969/files/PN_JIE-13.jpg?v=1674679911|https://cdn.shopify.com/s/files/1/1031/7969/files/PN_JIE-18.jpg?v=1674679926,sold-out,https://tbwbooks.com/products/juggling-is-easy-second-edition
Men Untitled,Carolyn Drake,false,"Sold out in the U.S. EU / UK orders only.






Soft flexicover with flaps, embossed tip-on and booklet

118 pages, 33 color / 23 duotone plates9 x 11.75 in. / 229 x 298 mmSigned by the artistBooklet with text in English and French

2023ISBN 978-1-942953-60-9TBW Books is pleased to present Men Untitled by Carolyn Drake, a new series of photographs exploring her relationship to myths of masculinity in American culture.Following Knit Club (2012–2020), a subversive work about a community of women in rural Mississippi, Drake shifts her gaze in Men Untitled. In contrast to her previous work, her subjects are uprooted from their geographies. Erasing nearly all signs of place, Drake invites the viewer to look directly at the male bodies in front of her camera.The subjects in Men Untitled appear nude or half-dressed, frozen in awkward poses, torsos twisted and bent, backward facing, wearing furniture, and even hung upside down. But they also appear to be at ease with—possibly even acting in collusion with—the artist.Still-lives punctuate the portraits: an anatomical model of male genitalia perches on a velvet chair, a charred board of nails stands erect, and a formidable snake wraps itself around an empty window frame.Playful on its surface, the work’s underlying levity is brought to the fore in Drake’s epilogue, which recounts a sequence of personal experiences that motivated the work.Carolyn Drake was awarded the 2021 HCB Award by the Fondation Henri Cartier-Bresson to produce this series of photographs. With a row of embossed white faces tipped on the cover, each book is signed by the artist.Printed in a limited edition of 1,500 copies.",https://cdn.shopify.com/s/files/1/1031/7969/files/TBW_6-20-2110101.jpg?v=1694644999,https://cdn.shopify.com/s/files/1/1031/7969/files/TBW_6-20-2110106.jpg?v=1694645080|https://cdn.shopify.com/s/files/1/1031/7969/files/TBW_6-20-2110113.jpg?v=1694645049|https://cdn.shopify.com/s/files/1/1031/7969/files/TBW_6-20-2110105.jpg?v=1694645105|https://cdn.shopify.com/s/files/1/1031/7969/files/TBW_6-20-2110111.jpg?v=1694645128|https://cdn.shopify.com/s/files/1/1031/7969/files/TBW_6-20-2110123.jpg?v=1694645157|https://cdn.shopify.com/s/files/1/1031/7969/files/TBW_6-20-2110094.jpg?v=1694645193,sold-out,https://tbwbooks.com/products/men-untitled
A Sudden Gust of Wind (after Hokusai),Jeff Wall,false,"Edition of 300 + 30 artist proofs98 unbound color plates in a folderSlipcase with tip-on and clamshell case14 x 11.8 in. / 355 x 300 mm (slipcase)90 x 148.4 in. / 229 x 377 cm (assembled)Signed and numbered2023ISBN 978-1-942953-53-1
TBW Books is pleased to present A Sudden Gust of Wind (after Hokusai) by Jeff Wall. The original, a transparency in a light box that is part of the permanent collection at Tate Modern, is not simply a photograph, and similarly this scale reproduction is not simply a book. Nearly a decade in the making, this collaboration between the artist and publisher responds to the challenge of how Wall's work, characterized by its synthesis of materiality and scale, could be rendered uniquely into book form.
TBW Books' A Sudden Gust of Wind (after Hokusai) reproduces the image, printed from the artist's original digital montage file, on 98 unbound lightweight sheets of paper. Once installed, the sheets' gentle movements, created by localized airflow, echo the fly-away energy of the papers in the original picture. This version of the work creates a new relationship between the image and the atmosphere that it has become renowned for evoking.With tremendous attention to printing, design, and quality of materials, this edition of only 300 copies is a conceptual achievement guided by the highest standards of bookmaking.
 
*This title does not qualify for free shipping.",https://cdn.shopify.com/s/files/1/1031/7969/files/TBW_JEFFWALL_INSTALL_small_20e05c78-605e-4d96-ab98-ad16d3a81f13.jpg?v=1667427392,https://cdn.shopify.com/s/files/1/1031/7969/files/JW__1.jpg?v=1667427422|https://cdn.shopify.com/s/files/1/1031/7969/files/JW__20.jpg?v=1667427551|https://cdn.shopify.com/s/files/1/1031/7969/files/JW__23.jpg?v=1667427593|https://cdn.shopify.com/s/files/1/1031/7969/files/JW__6.jpg?v=1667428415|https://cdn.shopify.com/s/files/1/1031/7969/files/JW__7.jpg?v=1667428434|https://cdn.shopify.com/s/files/1/1031/7969/files/JW__25.jpg?v=1667428498,sold-out,https://tbwbooks.com/products/a-sudden-gust-of-wind-after-hokusai
Painting Photographs,Alice Wong,false,"Flexicover with booklet76 pages, 58 color plates9.5 x 11.75 in. / 241 x 298 mm2023ISBN 978-1-942953-48-7
TBW Books is pleased to announce the publication of Painting Photographs, a new book by Creative Growth Art Center artist Alice Wong. Wong's bold interpretation of vintage vernacular photographs breathes new life into family album kitsch and cliché shots of plants and landscapes, transforming them into a hyper-color plane of vivid abstraction. Using paint markers to enhance and obscure the formal qualities of appropriated imagery, Wong's hand brings energy to each underlying image, recalibrating the viewer's eye and sparking appreciation for otherwise still compositions. With fluid mark-making and a striking approach to color-blocking, Wong's craft merges with the photographic process to create work that feels at once of times past and completely contemporary.
Creative Growth Art Center is the oldest and largest nonprofit art studio for artists with developmental disabilities in the United States. Since 1974, Creative Growth has played a significant role in increasing public interest in the artistic capabilities and achievements of people with disabilities, providing a professional studio environment for artistic development, gallery exhibition and representation.
Shortlisted for the 2023 Paris Photo – Aperture Foundation First PhotoBook Award",https://cdn.shopify.com/s/files/1/1031/7969/files/AW_PP-48.jpg?v=1685050578,https://cdn.shopify.com/s/files/1/1031/7969/files/AW_PP-4.jpg?v=1685050626|https://cdn.shopify.com/s/files/1/1031/7969/files/AW_PP-5.jpg?v=1685050647|https://cdn.shopify.com/s/files/1/1031/7969/files/AW_PP-6.jpg?v=1685050672|https://cdn.shopify.com/s/files/1/1031/7969/files/AW_PP-8.jpg?v=1685050693|https://cdn.shopify.com/s/files/1/1031/7969/files/AW_PP-11.jpg?v=1685050715|https://cdn.shopify.com/s/files/1/1031/7969/files/AW_PP-13.jpg?v=1685050731,sold-out,https://tbwbooks.com/products/painting-photographs
Man Unraveling,Alice Wong,false,"Softcover flip book with flaps60 pages, 30 color plates4.5 x 4.5 in. / 114 x 114 mm2023ISBN 978-1-942953-55-5
Presented in a flip-book style, Man Unraveling consists of twenty-eight painted-on photographic images by Creative Growth Art Center artist Alice Wong. Wong's colorful palette adorns a group of photographs of the Italian fashion designer Valentino as he works at his desk. Identified only by the book's title, Valentino's image gradually evolves into greater abstraction with the paintings' general sequence. With colored edges and a textured softcover with flaps, this interactive book is a vivid journey into Alice Wong's imaginative world. 
Creative Growth Art Center is the oldest and largest nonprofit art studio for artists with developmental disabilities in the United States. Since 1974, Creative Growth has played a significant role in increasing public interest in the artistic capabilities and achievements of people with disabilities, providing a professional studio environment for artistic development, gallery exhibition and representation.",https://cdn.shopify.com/s/files/1/1031/7969/files/AW_TBW-1.jpg?v=1685816738,https://cdn.shopify.com/s/files/1/1031/7969/files/AW_TBW-4.jpg?v=1685816904|https://cdn.shopify.com/s/files/1/1031/7969/files/AW_TBW-6.jpg?v=1685816770|https://cdn.shopify.com/s/files/1/1031/7969/files/AW_TBW-11.jpg?v=1685816783|https://cdn.shopify.com/s/files/1/1031/7969/files/AW_TBW-13.jpg?v=1685816797|https://cdn.shopify.com/s/files/1/1031/7969/files/AW_TBW-17.jpg?v=1685816807|https://cdn.shopify.com/s/files/1/1031/7969/files/AW_TBW-18.jpg?v=1685816817,sold-out,https://tbwbooks.com/products/man-unraveling
River's Dream Special Edition,Curran Hatleberg,false,"Edition of 30Signed and stamped book in a slipcase with an original signed print:Untitled (Camaro)Hahnemühle Gloss Baryta papersigned and numbered verso12.5 x 10.4 inches / 318 x 264 mm (sheet)2022Book details:152 pages, 65 color plates11.5 x 13.5 inches / 292 x 343 mm2022ISBN 978-1-942953-50-0

TBW Books is pleased to present River’s Dream, the latest monograph by Curran Hatleberg and a complete realization of the series exhibited at the 2019 Whitney Biennial. 
Hatleberg is known for traveling America, guided by intuition, to create scenes of American life and landscape. Working collaboratively with the people he meets, he recounts intimate stories of family and community. Here, in the follow-up to his first monograph Lost Coast (TBW Books, 2016), Hatleberg centers his narrative on the dog days of summer. Sweltering heat, dripping humidity, lush vegetation, and screaming insects—River’s Dream is a pulsing and episodic hallucination of life lived outdoors. In these sixty-five photographs, we move through swamps and groves, front yards and junkyards, encountering moments of haunting mystery and beautiful impermanence. Heightened by formal repetition, echo, and refrain, everyday scenes take on surreal, allegorical qualities. In the end, Hatleberg leaves us with the impression of memory, where the past is never gone, but appears and reappears endlessly, as in the flickering of a dream.
This book includes new texts by Natasaha Trethewey and Joy Williams.

Shortlisted for the 2022 Paris Photo / Aperture Photo Book of the Year Award
Press:
The New YorkerThe GuardianThe Guardian Best Photography Books of 2022The British Journal of PhotographyThe Oxford AmericanThe Washington PostBlind Magazine

 
*This title does not qualify for free shipping.",https://cdn.shopify.com/s/files/1/1031/7969/files/RiversDream_000.jpg?v=1649873749,,sold-out,https://tbwbooks.com/products/rivers-dream-slipcase-edition-with-print
Windscreen,Phil Jung,false,"Casebound hardcover with tip-on56 pages, 26 color plates16 x 13 in. / 40.64 x 33 cm2022ISBN 978-1-942953-45-6
In Phil Jung’s first monograph, Windscreen, we are positioned to peer through the windows of American cars that have seen better days. Captured on city streets, existing in a space somewhere between public and private, these car interiors are often found decrepit and empty, however each one comes alive through its inanimate details, the idiosyncratic marks of past and present owners, revealing a series of portraits without subjects.

Items both mundane and peculiar—empty packs of Carlton cigarettes, the shattered frame of a digital Van Gogh, a Ouija board planchette—trace the outlines of lives lived but not seen.  Scum, frost, and dead insects, appearing like beautiful color field abstractions, at times prevent us from seeing inside, and then the sudden presence of a disembodied hand makes us wonder if we should be looking at all.
Shot on Kodak 4x5 sheet film and printed with stunning articulation, Jung’s work, in its powerful use of color and composition, stands as an achievement of photographic formalism. But most striking is Jung’s deft and poetic evocation of the American social landscape told through renderings of automotive decay.


Press:

The Washington PostThe Brooklyn RailIt's Nice ThatZaptronic",https://cdn.shopify.com/s/files/1/1031/7969/files/PJ_W_39.jpg?v=1664491440,https://cdn.shopify.com/s/files/1/1031/7969/files/PJ_W_11.jpg?v=1664491054|https://cdn.shopify.com/s/files/1/1031/7969/files/PJ_W_12.jpg?v=1664491083|https://cdn.shopify.com/s/files/1/1031/7969/files/PJ_W_13.jpg?v=1664491100|https://cdn.shopify.com/s/files/1/1031/7969/files/PJ_W_16.jpg?v=1664491125|https://cdn.shopify.com/s/files/1/1031/7969/files/PJ_W_18.jpg?v=1664491159|https://cdn.shopify.com/s/files/1/1031/7969/files/PJ_W_21.jpg?v=1664491190,sold-out,https://tbwbooks.com/products/windscreen
Annual Series No. 7 — Four Book Set,Paul Kooiker / Mona Kuhn / Juergen Teller / Carmen Winant,false,"Carmen Winant | Juergen Teller | Mona Kuhn | Paul Kooiker
Hardcover8.75 x 11 in. / 222 x 279 mm2021ISBN 978-1-942953-44-9

For Annual Series No. 7, four artists were invited to approach the concept of the human form. Implementing stylistically distinct approaches, each book works to challenge the artist's own practice, making room for discovery within not only their own oeuvre but within the language of photography itself.  
 
While each book is thought of as a stand-alone title, an undeniable dialogue is shared between all four when presented together, allowing viewers to experience the collection as a singular photographic meditation.

 
Body Index by Carmen Winant
Body Index began a decade ago when Winant worked as a model for figure drawing classes and, as she explains, watched herself being watched from every angle. Affected by this moment in which the surveilled female body is transmuted into art, Winant began to collect and collage images of women posing—originally intended as anatomical reference photographs for artists—to explore how the female body is instrumentalized before the camera's gaze. In contextualizing these images anew, Winant locates and exposes a hidden rebellion within the posing bodies. Though originally rendered as blank learning instruments, Winant’s subjects reveal a self-possession, an upper hand, something errant. A range of other bodies appear atop these images—from lesbian separatists to massage therapists and beyond—melding into a single picture-plane that complicates the terms of gendered agency and stillness. Originally assembled as a modular piece separated into discrete panels containing hundreds of image cells, the images are here presented in a tightly curated selection, each figure holding a single page.
 
















 
 
 
The Nipple by Juergen Teller
In The Nipple the viewer is immediately confronted by the book's cover of Teller’s mask-wearing nude subject. The image, notably shot pre-pandemic, acts as an allusion to the ever precarious nature of our mortal bodies. In his iconically casual style, Teller continues to allude to the body by pointing us to unused and uncared for exercise equipment on empty European city streets. Eventually this repetition is punctuated by a personal element, the artist himself undergoing an endoscopic medical procedure, perhaps routine but possibly more serious. When not isolating the human body itself, he gives us devastated proxies for it: an unworn dinosaur costume inert and wrinkled on the floor, a desiccated frog that’s fallen victim to roadkill, a lifeless fish on dirty ground many days since its last gasp. By contrasting images of weakness and desolation with those of bodily vitality, Teller foreshadows brilliantly the isolation and tension that, at the time of printing, were still yet to come.
 
















 
 
Study by Mona Kuhn
For Study, Mona Kuhn returns to the darkroom for the very reason she fell in love with photography: the latent image. Inspired by the surrealist photographers of the 1920’s, she explores the ethereal quality of solarization. A visually distinct process­ through which the photographed subject seems underlined by the alchemist’s pencil, solarization is thought to be discovered by Lee Miller while printing for Man Ray, who ultimately took credit for the discovery. The method is as complex and uncertain as the human form itself; consequently the recipes from the past no longer work on present-day materials. Like the figure in her images, Kuhn sought to find her own balance, the results culminating in a series of unique prints that reveal layers of silver glow in the form of oxidized magic.
Kuhn’s experiments in crystallizing the latent image mirror the Kafkaesque existence of her subject. From a vulnerable and inquisitive sense of self to the confident posture of a man addressing the invisible masses, the perfectly contained to dematerialized silhouettes, the photographs emphasize an absurd nuance, teetering on the edge of reality and surreality.
 
















 
 
 
Business of Fashion by Paul Kooiker
Business of Fashion was created in 2018 when photographer Paul Kooiker was invited by Michéle Lamy to do an art performance during Voices, an annual invitation-only event organized by the Business of Fashion (BOF) that gathers some of the most influential tastemakers of the global fashion industry, uniting them with innovators and entrepreneurs who together hold great influence on popular culture.
 Kooiker’s response to Lamy’s request was to photograph the guests one by one, equalizing them by capturing each from the neck down in a uniform “limbs-splayed” pose. Shot against a blank grayscale backdrop, the subjects, often accustomed to public recognition, become semi-anonymous, headless mannequins reminiscent of the window displays, mail order catalogues, and online marketplaces that drive the industry forward.  Balancing a voyeuristic intrigue with tongue-in-cheek humor, the photographs reveal to the viewer the often banal clothing of those who are anything but.",https://cdn.shopify.com/s/files/1/1031/7969/files/Winant-07_for_website_2048x2048.jpg?v=1616536342,https://cdn.shopify.com/s/files/1/1031/7969/files/Winant-11_for_website_2048x2048.jpg?v=1616536384|https://cdn.shopify.com/s/files/1/1031/7969/files/Winant-12_for_website_2048x2048.jpg?v=1616536423|https://cdn.shopify.com/s/files/1/1031/7969/files/Winant-26_for_website_2048x2048.jpg?v=1616536456|https://cdn.shopify.com/s/files/1/1031/7969/files/Teller-06_for_website_2048x2048.jpg?v=1616536008|https://cdn.shopify.com/s/files/1/1031/7969/files/Teller-08_for_website_2048x2048.jpg?v=1616536046|https://cdn.shopify.com/s/files/1/1031/7969/files/Teller-10_for_website_2048x2048.jpg?v=1616536107,sold-out,https://tbwbooks.com/products/annual-series-no-7-four-book-set
